{
  "job_id": "job_abc123def456",
  "message_type": "job_completed",
  "created_at": "2024-01-15T11:15:00Z",
  "correlation_id": "f47ac10b-58cc-4372-a567-0e02b2c3d479",
  "retry_count": 0,
  "payload": {
    "results_summary": {
      "total_evaluations": 100,
      "passed_evaluations": 87,
      "failed_evaluations": 13,
      "average_score": 0.83,
      "pass_rate": 0.87
    },
    "results_blob_ref": {
      "blob_id": "550e8400-e29b-41d4-a716-446655440000",
      "storage_account": "copilotevaldata",
      "container": "job-results",
      "blob_name": "jobs/2024/01/job_abc123def456/results.json",
      "content_type": "application/json",
      "size_bytes": 2048576,
      "created_at": "2024-01-15T11:15:00Z",
      "expires_at": "2024-02-15T11:15:00Z",
      "access_url": "https://copilotevaldata.blob.core.windows.net/job-results/jobs/2024/01/job_abc123def456/results.json?sv=2022-11-02&ss=b&srt=o&sp=r&se=2024-01-15T12:15:00Z&st=2024-01-15T11:15:00Z&spr=https&sig=..."
    }
  },
  "blob_references": [
    {
      "blob_id": "550e8400-e29b-41d4-a716-446655440000",
      "storage_account": "copilotevaldata",
      "container": "job-results",
      "blob_name": "jobs/2024/01/job_abc123def456/results.json",
      "content_type": "application/json",
      "size_bytes": 2048576,
      "created_at": "2024-01-15T11:15:00Z",
      "expires_at": "2024-02-15T11:15:00Z",
      "access_url": "https://copilotevaldata.blob.core.windows.net/job-results/jobs/2024/01/job_abc123def456/results.json?sv=2022-11-02&ss=b&srt=o&sp=r&se=2024-01-15T12:15:00Z&st=2024-01-15T11:15:00Z&spr=https&sig=..."
    }
  ]
}