{
  "job_id": "job_abc123def456",
  "message_type": "job_progress",
  "created_at": "2024-01-15T10:45:00Z",
  "correlation_id": "f47ac10b-58cc-4372-a567-0e02b2c3d479",
  "retry_count": 0,
  "payload": {
    "progress": {
      "total_items": 100,
      "completed_items": 45,
      "percentage": 45.0
    },
    "current_item": "item_045",
    "estimated_time_remaining": "PT15M30S"
  },
  "blob_references": []
}